{
  "schema": "flop-spec-authority-v1",
  "domain": "FLOP_SPEC_AUTHORITY\u0000V1",
  "canonical_encoding_revision": "SORTED_ASCII_JSON_V1",
  "status": "DESCRIPTIVE_ONLY",
  "content_label": "UNTRUSTED_CONTENT",
  "artifact_id": "da8bbc20d7b9eaf54984448d5b80b138876ced075d8790c5c3624e62e76d5b70",
  "source_set_complete": false,
  "sources": [
    {"source_id":"FLOP_TEASER_CAPTURE","source_type":"TEASER","authority":"OFFICIAL_CONTEXT","material_status":"OFFICIAL_DRAFT","revision":"teaser-capture-2026-08-27","document_hash":"f93b07c83d71f09926ee536f4e704b52336e4f8c3e6f0a3752d45224a39d3fde","identity_verified":true,"revision_verified":true,"hash_verified":true,"content_attested":true},
    {"source_id":"YELLOW_PAPER_V0_5_0_CANDIDATE","source_type":"YELLOW_PAPER","authority":"UNVERIFIED_SOURCE","material_status":"UNVERIFIED_CANDIDATE","revision":"REVISION_UNVERIFIED","document_hash":"HASH_UNVERIFIED","identity_verified":false,"revision_verified":false,"hash_verified":false,"content_attested":false}
  ],
  "claims_extracted": true,
  "claims": [
    {"claim_id":"31cf73b749219027e8144a484ce95907b18c72286934ed995af545ae3642374d","category":"AGENT_ALLOCATION","value":"1200000000","unit":"FLOP","approximation":true,"source_id":"FLOP_TEASER_CAPTURE","source_type":"TEASER","authority":"OFFICIAL_CONTEXT","source_revision":"teaser-capture-2026-08-27","document_hash":"f93b07c83d71f09926ee536f4e704b52336e4f8c3e6f0a3752d45224a39d3fde","source_identity_verified":true,"revision_verified":true,"hash_verified":true,"extraction_verified":true,"claim_kind":"VERIFIED_SOURCE_BOUND_CLAIM","evidence_status":"VERIFIED_LOCAL_EVIDENCE","parameter_status":"CONFLICTING","ratification_state":"RATIFICATION_UNRESOLVED","conflict_set_id":"AGENT_ALLOCATION_CONFLICT","canonical_encoding_revision":"SORTED_ASCII_JSON_V1"},
    {"claim_id":"68834f685e930579f537d8ba62f1f1d26dc3a1bc87fd9a9148069cddbe058abd","category":"AGENT_ALLOCATION","value":"596030000","unit":"FLOP","approximation":true,"source_id":"YELLOW_PAPER_V0_5_0_CANDIDATE","source_type":"YELLOW_PAPER","authority":"UNVERIFIED_SOURCE","source_revision":"REVISION_UNVERIFIED","document_hash":"HASH_UNVERIFIED","source_identity_verified":false,"revision_verified":false,"hash_verified":false,"extraction_verified":false,"claim_kind":"UNVERIFIED_REPORTED_CLAIM","evidence_status":"SOURCE_EVIDENCE_REQUIRED","parameter_status":"CONFLICTING","ratification_state":"RATIFICATION_UNRESOLVED","conflict_set_id":"AGENT_ALLOCATION_CONFLICT","canonical_encoding_revision":"SORTED_ASCII_JSON_V1"},
    {"claim_id":"e4aeaefddb1ae36ae7533d397d537772296fdf709c8e29b18e36caba09db66b9","category":"GENESIS_AIRDROP","value":"3500000000","unit":"FLOP","approximation":false,"source_id":"FLOP_TEASER_CAPTURE","source_type":"TEASER","authority":"OFFICIAL_CONTEXT","source_revision":"teaser-capture-2026-08-27","document_hash":"f93b07c83d71f09926ee536f4e704b52336e4f8c3e6f0a3752d45224a39d3fde","source_identity_verified":true,"revision_verified":true,"hash_verified":true,"extraction_verified":false,"claim_kind":"UNVERIFIED_REPORTED_CLAIM","evidence_status":"SOURCE_EVIDENCE_REQUIRED","parameter_status":"CONFLICTING","ratification_state":"RATIFICATION_UNRESOLVED","conflict_set_id":"GENESIS_AIRDROP_CONFLICT","canonical_encoding_revision":"SORTED_ASCII_JSON_V1"},
    {"claim_id":"d89bcab8af10472f20926faa25550da15bcca5a3a21b3a15a115857666b365e4","category":"GENESIS_AIRDROP","value":"2483460000","unit":"FLOP","approximation":false,"source_id":"YELLOW_PAPER_V0_5_0_CANDIDATE","source_type":"YELLOW_PAPER","authority":"UNVERIFIED_SOURCE","source_revision":"REVISION_UNVERIFIED","document_hash":"HASH_UNVERIFIED","source_identity_verified":false,"revision_verified":false,"hash_verified":false,"extraction_verified":false,"claim_kind":"UNVERIFIED_REPORTED_CLAIM","evidence_status":"SOURCE_EVIDENCE_REQUIRED","parameter_status":"CONFLICTING","ratification_state":"RATIFICATION_UNRESOLVED","conflict_set_id":"GENESIS_AIRDROP_CONFLICT","canonical_encoding_revision":"SORTED_ASCII_JSON_V1"}
  ],
  "conflicts": [
    {"conflict_set_id":"AGENT_ALLOCATION_CONFLICT","category":"AGENT_ALLOCATION","claim_ids":["31cf73b749219027e8144a484ce95907b18c72286934ed995af545ae3642374d","68834f685e930579f537d8ba62f1f1d26dc3a1bc87fd9a9148069cddbe058abd"],"state":"SOURCE_EVIDENCE_REQUIRED","ratification_evidence_present":false,"current_parameter_resolved":false},
    {"conflict_set_id":"GENESIS_AIRDROP_CONFLICT","category":"GENESIS_AIRDROP","claim_ids":["e4aeaefddb1ae36ae7533d397d537772296fdf709c8e29b18e36caba09db66b9","d89bcab8af10472f20926faa25550da15bcca5a3a21b3a15a115857666b365e4"],"state":"SOURCE_EVIDENCE_REQUIRED","ratification_evidence_present":false,"current_parameter_resolved":false}
  ],
  "scoring_uncertainty": {"airdrop_scoring":"UNRESOLVED","testnet_mainnet_conversion":"UNRESOLVED","scoring_cap":"UNRESOLVED","scoring_curve":"UNRESOLVED","minimum_activity":"UNRESOLVED","agent_vesting":"UNRESOLVED","spend_to_unlock":"UNRESOLVED","final_agent_allocation":"UNRESOLVED","inference_spend_allocation_relationship":"UNRESOLVED"},
  "runtime_compatibility": "COMPATIBILITY_REVIEW_REQUIRED",
  "action_state": {"mode":"NO_LIVE_ACTION","ready_to_act":false,"authorized_to_act":false,"live_action_enabled":false},
  "policy_version": "flop-spec-authority-policy-v1"
}
